"Location.City","Location.State","Location.Country","Data.Shape","Data.Encounter duration","Data.Description excerpt","Location.Coordinates.Latitude ","Location.Coordinates.Longitude ","Dates.Sighted.Year","Dates.Sighted.Month","Date.Sighted.Day","Dates.Sighted.Hour","Dates.Sighted.Minute","Dates.Documented.Year","Dates.Documented.Month","Dates.Documented.Day"
"chester","WV","US","light","900.0","Three UFOs in formation seen by many on the night of July 4&#44 2008 in Chester&#44 WV.","40.6130556","-80.5630556","2008","7","4","22","50","2008","8","12"
"clarksburg","WV","US","circle","120.0","Round&#44 pulsating orange object in the sky -- no noise","39.2805556","-80.3447222","2013","2","2","20","0","2013","2","18"
"clarksburg","WV","US","circle","120.0","Large Disc hovering over a National Guard Armoy for 2 minutes then gone.","39.2805556","-80.3447222","1985","5","15","20","0","2005","10","11"
"clarksburg","WV","US","disk","30.0","Silver glowing disk hovering in the sky above Clarksburg&#44 WV.","39.2805556","-80.3447222","2012","12","20","22","30","2013","8","30"
"clarksburg","WV","US","disk","7200.0","Asatched the light travel back and forth and uyou could see no craft. When the light went off&#44 oh my God.","39.2805556","-80.3447222","1979","11","22","23","0","2011","1","5"
"clarksburg","WV","US","oval","5400.0","tHE OBJECT MOVED FROM SIDE TO SIDE AND UP AND DOWN AND WAS GONE IN A FLASH","39.2805556","-80.3447222","1980","11","21","0","0","2008","2","14"
"clarksburg","WV","US","oval","300.0","three orange glowing balls.","39.2805556","-80.3447222","2011","1","1","0","0","2011","1","5"
"clarksburg","WV","US","unknown","360.0","A  &quot;star&quot; that  wasnt a star","39.2805556","-80.3447222","2002","7","6","23","0","2002","7","26"
"colliers","WV","US","disk","180.0","There was a lighted object in the summer sky; I knew it couldn&#39t be ours.","40.3669444","-80.5413889","1974","8","25","21","0","2002","12","23"
"cowen","WV","US","sphere","60.0","Blue sphere","38.4094444","-80.5580556","2012","3","23","20","30","2012","5","13"
"craigsville","WV","US","light","120.0","((NUFORC Note:  Possible sighting of Intl. Space Station.  PD))  07/04/05 &#44 11.:00pm&#44 Craigsville WV&#44 craft traveling high&#44 2 min&#44","38.3305556","-80.6533333","2005","7","4","23","0","2005","7","5"
"crawley","WV","US","light","180.0","The ufo was very bright and made no sound what so ever.and at times my new fully charged spot light would go out or get real dim.","37.9347222","-80.6522222","2012","11","21","18","0","2012","12","20"
"cross lanes","WV","US","cylinder","300.0","Noticed a very shiny object at a very high altitude that looked like a strange jet. It left a contrial and moved across the sky at abou","38.4202778","-81.7908333","1999","3","23","18","15","1999","4","2"
"cross lanes","WV","US","light","4.0","Orangish Objects Zig Zag across the sky as fast as a shooting star.","38.4202778","-81.7908333","2010","10","19","23","0","2012","9","24"
"cross lanes","WV","US","other","180.0","Orange polygon shaped aircraft.","38.4202778","-81.7908333","2013","5","23","20","15","2013","6","2"
"cross lanes","WV","US","oval","900.0","Hovering Orb","38.4202778","-81.7908333","2007","5","23","15","30","2007","6","12"
"cross lanes","WV","US","triangle","120.0","It was triangular and had lights on all corners with a glow coming from the center","38.4202778","-81.7908333","2012","6","22","9","0","2012","7","4"
"crown hill","WV","US","triangle","420.0","One huge Black triange with white lights followed by a second smaller triangle with blue lights","38.2","-81.4138889","2007","10","20","20","20","2008","3","4"
"culloden","WV","US","unknown","300.0","We had been to a bonfire on a friends farm.  As we were returning home&#44 we were passing through this small town when I looked at the dr","38.42","-82.0555556","1978","11","1","3","0","2001","8","5"
"danese","WV","US","unknown","300.0","Traveling at a speed of 1500 MPH and stopping instantly displaying Super Bright Search Lights no Noise.","37.9305556","-80.9033333","1971","7","14","22","0","2006","10","30"
"daniels","WV","US","light","1800.0","18:20 hours&#44 235 degrees southwest twinkling and moving object seen.","37.7430556","-81.1230556","2007","12","31","18","20","2008","2","14"
"daniels","WV","US","unknown","60.0","Small white light floats at constant speed in straight line over Daniels&#44 WV.","37.7430556","-81.1230556","2012","6","6","23","0","2012","6","8"
"davis","WV","US","light","600.0","Large Flickering Light","39.1286111","-79.465","2009","10","15","22","0","2010","4","13"
"dunbar","WV","US","light","1800.0","Orange light over Charleston&#44 WV area","38.3605556","-81.7375","2011","7","13","22","0","2011","7","17"
"dunbar","WV","US","light","300.0","2 singular lights traveling south to north with a third appearing to go straight up till fading out.","38.3605556","-81.7375","2001","10","3","20","20","2001","10","12"
"edray","WV","US","light","25.0","Intensely bright red light in the sky which hovered shortly direclty overhead and was seen again in woods minutes later","38.2744444","-80.0916667","2011","3","8","23","35","2012","3","13"
"eleanor","WV","US","cigar","120.0","Driving In Car when it appeared appeared in sky. It was long and silver with a long black line in the middle.","38.5375","-81.9325","1999","8","15","16","0","2002","7","1"
"elizabeth","WV","US","circle","420.0","My friend and i where in a car at 1:30 and a bright white flashing light.","39.0633333","-81.3952778","2007","1","20","1","0","2007","2","1"
"elkins","WV","US","changing","900.0","Explosive cloud over  West Virginia&#44 high altitude?    ((NUFORC Note:  Result of earlier missile launch.  PD))","38.9258333","-79.8469444","2004","8","31","21","0","2004","9","1"
"elkins","WV","US","circle","60.0","My wife was outside smoking a cigarette while I was in my office.  She knocked on window and I immediately went outside because she had","38.9258333","-79.8469444","2011","5","27","21","5","2011","5","29"
"elkins","WV","US","egg","5.0","Dark gray &amp;quot;egg&amp;quot; spotted hovering in daytime sky&#44 disappears suddenly","38.9258333","-79.8469444","2013","7","19","17","0","2013","8","30"
"elkins","WV","US","light","15.0","3 white lights in triangular formation + rapid independent movement seen over Elkins&#44 WV","38.9258333","-79.8469444","2010","2","6","21","40","2010","2","14"
"enterprise","WV","US","oval","10.0","3 separate sightings: blue jellyfish and two red globes","39.4208333","-80.2780556","2012","2","6","1","0","2012","3","13"
"eskdale","WV","US","unknown","30.0","Bright like an arc welder","38.0911111","-81.4438889","2012","5","18","23","0","2012","5","29"
"evans","WV","US","changing","1200.0","Changing orange object over treeline.","38.8202778","-81.7797222","2002","7","26","23","50","2002","8","16"
"fairmont","WV","US","diamond","600.0","I Just woke up and looked out my window and saw two dimond saped bright green and had four  wings.","39.485","-80.1427778","2001","8","19","1","30","2001","8","20"
"fairmont","WV","US","fireball","300.0","6/11/2011 West Virginia fireballs in the evening sky.","39.485","-80.1427778","2011","6","11","21","0","2011","6","20"
"fairmont","WV","US","light","7200.0","Spinning UFO&#39s over West Virginia","39.485","-80.1427778","2012","6","15","3","0","2012","6","20"
"fairmont","WV","US","light","300.0","Three smooth gliding amber lights;no blinkers&#44two kept same distance apart moving WSW to ESE as moon stayed still while one followed.","39.485","-80.1427778","2014","2","18","1","40","2014","2","21"
"fairmont","WV","US","sphere","120.0","Illuminated spear viewed over Fairmont WV on 11-03-12 at 8:28 PM.","39.485","-80.1427778","2012","11","3","20","28","2012","11","4"
"fairmont","WV","US","unknown","360.0","Bright white object moving west to east.  ((NUFORC Note:  Probable sighting of the ISS??  PD))","39.485","-80.1427778","2013","6","19","23","0","2013","7","3"
"falling waters","WV","US","light","1398.0","Starlike object which dissapeared very strangely.","39.5591667","-77.8911111","2008","2","19","23","0","2008","3","4"
"farmington","WV","US","light","10.0","Small light seen zig-zagging over West Virginia camp","39.5127778","-80.2491667","2002","7","10","22","13","2002","7","26"
"fayetteville","WV","US","changing","2100.0","Upon letting my dogs out&#44 I observed a bright flashingight i&#39n the NE sky. This light moved rapidly and randomly. It appeared to have r","38.0527778","-81.1041667","2013","9","25","22","25","2013","9","30"
"fayetteville","WV","US","chevron","2.0","Band of lights traveled north to south&#44 silent&#44. Clear night.","38.0527778","-81.1041667","2013","3","9","20","30","2013","5","15"
"fayetteville","WV","US","diamond","1200.0","Orange sphere following family of four","38.0527778","-81.1041667","2011","7","6","21","0","2012","5","13"
"fayetteville","WV","US","fireball","10800.0","Baseball on fire.","38.0527778","-81.1041667","2014","4","13","2","0","2014","4","18"
"fayetteville","WV","US","sphere","420.0","something followed my family and left a piece behind","38.0527778","-81.1041667","2010","1","12","0","0","2010","2","14"
"flatwoods","WV","US","circle","60.0","I saw the craft go across the horizon.  It appeared to be on fire&#44 I first thought it was a plane going down.  It landed near a farm.","38.7230556","-80.65","1954","10","1","19","0","2013","4","12"
"follansbee","WV","US","other","20.0","On 3/6/05 at approx.20:30 EST I wittnessed an very bright round banded object in the sky which began to fade away from me &amp; diminish.","40.3275","-80.5961111","2005","3","6","20","30","2005","5","11"
"follansbee","WV","US","other","10.0","The craft appeared and looked like a pearl material and had a metal circle on the bottom.","40.3275","-80.5961111","2001","6","11","0","0","2012","5","13"
"follansbee","WV","US","triangle","300.0","Black triangle shape with 2 bright white lights and 4 deep red lights. Back curved inward. no markings no sound. hovered above treeline","40.3275","-80.5961111","2007","7","20","4","0","2007","8","7"
"four states","WV","US","sphere","600.0","MYSTERIOUS RED LIGHTS  IN NORTHERN WEST VIRGINIA","39.4797222","-80.31","1959","10","16","22","30","2008","3","31"
"gay","WV","US","light","120.0","White light going accross the sky horizontally at a rapid speed&#44 then turned red and disapeared","38.7705556","-81.5533333","2008","6","6","22","27","2008","6","12"
"genoa","WV","US","cigar","300.0","Me and my brother saw a cigar shaped object move quietly and very slowly above us for about 5 minutes.","38.1219444","-82.46","1971","7","15","12","0","2006","12","7"
"gerrardstown","WV","US","disk","12.0","The disk had four lights&#44one long on each third and a fourth in the center flashing emitting beams of light as it moved","39.3702778","-78.0958333","2000","9","27","1","24","2000","12","9"
"gerrardstown","WV","US","triangle","120.0","In the paper &quot;The Journal&quot; It stated that this month would be the month to see space satalites that would be visible in the night sky b","39.3702778","-78.0958333","2004","5","13","9","50","2004","6","4"
"ghent","WV","US","egg","600.0","It was scary&#33","37.6169444","-81.115","1987","3","8","12","27","2001","4","1"
"glenville","WV","US","sphere","240.0","Orage orb over Glenville WV","38.9341667","-80.8377778","2008","4","10","1","30","2008","6","12"
"great cacapon","WV","US","light","600.0","Bright disappearing lights in sky near Great Cacapon&#44 WV 7/14/01","39.62","-78.2927778","2001","7","14","21","0","2001","8","5"
"great cacapon","WV","US","triangle","300.0","Me and my ex-fiance were fooling around in the woods&#44 it was deer season so i had my rifle equiped with a high power tasco scope&#44 we we","39.62","-78.2927778","1998","11","1","17","0","2002","7","26"
"griffithsville","WV","US","cylinder","45.0","I am a &quot;Line Servicer&quot; for a large power conpany with 30 yrs. of service. While investigating an outage&#44 ( unrelated to UFO activity)&#44","38.2386111","-81.9894444","2006","12","8","22","30","2007","2","1"
"harpers ferry","WV","US","unknown","4.0","Object viewed with telescope moving a high rate of speed outside our solar system.","39.3252778","-77.7391667","2014","2","22","22","10","2014","2","27"
"harrisville","WV","US","light","120.0","Lime green bar of light in evening sky.","39.2094444","-81.0519444","2008","4","8","20","30","2012","10","30"
"hedgesville","WV","US","disk","600.0","disk shape object with beam","39.5533333","-77.9952778","1996","6","30","22","30","2010","4","13"
"hedgesville","WV","US","light","14400.0","Bright star-like craft flying over the valley just about every night and posted web info on it just seems to disappear.","39.5533333","-77.9952778","2010","7","10","21","0","2010","7","19"
"hedgesville","WV","US","light","1800.0","a star like light moving irratically and changing colors (red&#44green/blue&#44 white)","39.5533333","-77.9952778","2005","9","6","22","15","2005","10","11"
"hedgesville","WV","US","light","600.0","10-15 lights over hedgesville&#44 WV","39.5533333","-77.9952778","2005","3","20","8","30","2006","3","11"
"hedgesville","WV","US","other","15.0","05/05/2012 Orange object spotted in Hedgesville&#44 WV that appeared and vanished within 15 seconds at around 11 pm.","39.5533333","-77.9952778","2012","5","5","23","0","2012","5","13"
"hillsboro","WV","US","circle","14400.0","Largo red object sitting over a ridge. If indeed it was hovering over this ridge it was very large. Well over 100 feet. It attracted my","38.1352778","-80.2133333","1973","6","15","14","0","2003","7","16"
"hillsboro","WV","US","light","4140.0","Brilliant light hovers over mountain.  ((NUFORC Note:  Probably a star or planet&#44 we suspect.  PD))","38.1352778","-80.2133333","2008","8","15","1","30","2008","10","31"
"hinton","WV","US","light","300.0","Two lights at extremely high altitude and speed&#44 travelling parallel to each other&#44 in an Westerly direction.  They first appeared to b","37.6738889","-80.8894444","1998","12","15","22","30","2000","6","6"
"hinton","WV","US","light","900.0","Single light travelling at high rate of speed&#44 radically changed course numerous times.  Stayed in same area for entire time&#44 orbiting","37.6738889","-80.8894444","1998","10","15","22","0","2000","6","6"
"hinton","WV","US","other","1500.0","Stationary&#44 bright &#44flashing object seen in the southeastern sky.","37.6738889","-80.8894444","2009","3","2","19","0","2009","3","19"
"hooverson heights","WV","US","other","60.0","zig zaging point of light witnessed by dozens in northern West Virginia","40.3247222","-80.5777778","1989","6","7","22","0","2003","11","26"
"hundred","WV","US","oval","30.0","Object traveled across hills at moderate speed illuminating tree tops as it passed.","39.6836111","-80.4591667","1966","9","8","20","30","2008","10","31"
"huntersville","WV","US","formation","300.0","Moving Formation of Orange lights in the sky","38.1886111","-80.0163889","2011","9","17","20","30","2012","5","13"
"huntington","WV","US","changing","180.0","It started out as five lights&#44 then went to one bright light&#44 then the light turned into a ring&#44 and then back into a ball.","38.4191667","-82.4452778","2002","11","30","2","30","2002","12","23"
"huntington","WV","US","cigar","300.0","cigar shape objects came from the South heading toward the Ohio River to the North","38.4191667","-82.4452778","2008","6","30","17","0","2009","5","12"
"huntington","WV","US","circle","60.0","circular object that was amber in color suddenly appeared in the sky","38.4191667","-82.4452778","2001","3","8","23","30","2001","3","16"
"huntington","WV","US","circle","60.0","Two circular objects noted in So. WV in 1966&#44 made 90 degree turns without changing speed.","38.4191667","-82.4452778","1966","9","30","21","0","2003","3","21"
"huntington","WV","US","circle","60.0","Circular black object with single bright white light&#44 hovering&#44 turning&#44 then moving at incredible speed.","38.4191667","-82.4452778","2010","9","4","19","0","2010","11","21"
"huntington","WV","US","cone","180.0","Security guard and I watched an &quot;ice cream cone&quot; like object.","38.4191667","-82.4452778","2007","2","23","20","40","2007","2","24"
"huntington","WV","US","cross","600.0","Red and white &quot;T&quot; shaped objects with small white lights falling from the white ones and all disappearing at the same point i","38.4191667","-82.4452778","2013","11","3","20","0","2013","11","11"
"huntington","WV","US","cylinder","600.0","cylinder shaped object with no lights or sound with plane following behind it","38.4191667","-82.4452778","2008","10","1","5","0","2009","1","10"
"huntington","WV","US","cylinder","60.0","cylinder shaped craft enters cloud bank and never reappears","38.4191667","-82.4452778","2004","7","12","17","40","2004","7","25"
"huntington","WV","US","disk","120.0","I and my girlfriend watched a silvery luminous football shaped object.","38.4191667","-82.4452778","2008","2","28","16","0","2008","3","31"
"huntington","WV","US","fireball","1.0","I looked up and saw a round object streak through the sky.","38.4191667","-82.4452778","2009","6","9","23","0","2009","8","5"
"huntington","WV","US","fireball","180.0","Was driving home from store and looked up and saw an orange fire ball in the sky at first i thought it was a meteor but then it hover a","38.4191667","-82.4452778","2014","1","18","20","30","2014","1","24"
"huntington","WV","US","fireball","1236.0","Outside smoking a cigarette seen it goes straight up went over to the last for about 10 miles until we couldn&#39t see it anymore then sta","38.4191667","-82.4452778","2014","2","1","20","33","2014","2","7"
"huntington","WV","US","light","600.0","craft far off in distance with different colored lights.","38.4191667","-82.4452778","2006","8","22","0","1","2006","10","30"
"huntington","WV","US","light","15.0","Watched a bright luminous light approach low over city From the S/W. Made no sound as it moved at a slow steady rate speed. As it came","38.4191667","-82.4452778","1999","12","29","19","20","2000","1","7"
"huntington","WV","US","light","90.0","Numerous star-like objects observed in Huntington&#44 WV","38.4191667","-82.4452778","2013","8","2","21","30","2013","8","30"
"huntington","WV","US","other","10.0","Weird&#44 maybe a meteor passing through atmosphere. But on and off blue then red&#44 orange and back to blue strobing light. Illuminating th","38.4191667","-82.4452778","2014","2","4","21","58","2014","2","7"
"huntington","WV","US","oval","60.0","It was a scary oval shaped craft.","38.4191667","-82.4452778","2012","2","3","20","22","2012","2","10"
"huntington","WV","US","rectangle","60.0","A bright star suddenly appeared in the western sky. It then fell toward the earth in a streak of white light. Near the horizon&#44 it sudd","38.4191667","-82.4452778","1999","9","1","23","30","1999","9","12"
"huntington","WV","US","teardrop","900.0","A blaze orange upside down tear drop shaped object over southern Ohio.","38.4191667","-82.4452778","2007","2","22","20","32","2007","2","24"
"huntington","WV","US","triangle","45.0","Triangular object with red lights&#44 moved from hover to bullet speed in an instant. 2 observations&#44 2 different towns","38.4191667","-82.4452778","1966","9","15","23","0","2003","3","21"
"huntington","WV","US","triangle","120.0","30 foot triangle shaped&#44 constant humming&#44 static electric which made face and arms tingle&#44 disapeared toward the west.","38.4191667","-82.4452778","2001","4","22","20","50","2001","4","28"
"huntington","WV","US","unknown","60.0","A distortion","38.4191667","-82.4452778","2001","11","1","21","0","2001","11","20"
"huntington","WV","US","unknown","360.0","Kanawha River West Virgina 1994","38.4191667","-82.4452778","1994","12","25","4","30","2005","12","16"
"huntington","WV","US","unknown","15.0","At ~6:45 a.m. on 12-26-99&#44 I watches a football shaped light approached from the S/West and travel N/East&#44it remained as constant starl","38.4191667","-82.4452778","1999","12","26","6","45","2000","1","7"
"huntington","WV","US","unknown","60.0","A distortion in the sky that moved and stopped&#44 then moved again.","38.4191667","-82.4452778","2001","11","1","21","0","2001","11","20"
"hurricane","WV","US","circle","2.0","I was riding in the car and looked out the window. I then saw a circle about as big as a full moon flash across the sky and the disappe","38.4325","-82.0202778","1997","11","10","21","45","1999","2","16"
"hurricane","WV","US","triangle","360.0","Large triangle red lights seen by many","38.4325","-82.0202778","2012","9","5","21","0","2012","9","24"
"hurricane","WV","US","triangle","300.0","UFO Sighting - Black Triangle. Close Up View Of Object. West Virginia 2002","38.4325","-82.0202778","2002","12","8","20","30","2005","9","2"
"hurricane","WV","US","unknown","300.0","Slow moving&#44 green lights&#44 huge object.  Sunnybrook Rd. area&#44 but could be seen for miles.","38.4325","-82.0202778","1999","3","15","20","0","2003","5","9"
"inwood","WV","US","triangle","10.0","Orange triangle with flames from tail shooting through sky above tree line","39.3577778","-78.0402778","2012","8","8","23","30","2012","8","19"
"jakes run","WV","US","light","600.0","Not a plane. Not a star. The most amazing thing I ever saw.","39.6580556","-80.1713889","2012","7","11","1","0","2012","8","5"
"kearneysville","WV","US","disk","300.0","Silver colored saucer with dark trim around the bottom and top/middle.","39.3880556","-77.8858333","2012","7","9","13","0","2012","8","5"
"kearneysville","WV","US","fireball","300.0","5 or more orange lights.","39.3880556","-77.8858333","2013","11","30","22","30","2013","12","2"
"kearneysville","WV","US","light","90.0","4-5 bright lights were seen approximately equally spaced from each other moving from the west to the east.  They appeared to be moving","39.3880556","-77.8858333","1999","11","16","19","5","1999","12","16"
"kenna","WV","US","circle","300.0","Round object with lights hovered for a wile and then accelerated increadably fast&#44 not of this world.","38.6763889","-81.6602778","1979","9","1","20","0","2007","2","1"
"kenna","WV","US","egg","3.0","First let me say this is going to sound crazy.  I was watching National Lampoons vacation.  When they were doing the Walley world scene","38.6763889","-81.6602778","2003","6","12","16","53","2003","7","16"
"kenova","WV","US","circle","60.0","I saw a large&#44 bright circular light&#44 followed by a lot of &quot;sparks&quot;.","38.3988889","-82.5783333","2009","9","16","22","0","2009","12","12"
"keyser","WV","US","flash","120.0","red and white lights tjat telaported across the sky moving with strange angels.","39.4408333","-78.9741667","2013","12","27","0","0","2014","1","10"
"keyser","WV","US","light","7.0","I was in the back yard running my dogs and talking to my father on the phone when I sighted a light moving east to west approx. 5000 ft","39.4408333","-78.9741667","2010","11","13","17","30","2010","11","21"
"lakin","WV","US","light","300.0","bright light hovering in the sky over lakin west virgina","38.9586111","-82.0872222","2005","2","16","20","0","2005","2","22"
"lashmeet","WV","US","triangle","300.0","I saw a gray hazy metallic triangle shaped object with 3 blue lights and an appearance of being transparent in form.","37.4208333","-81.1994444","1997","6","1","12","0","2008","10","31"
"lavalette","WV","US","circle","180.0","Satellite looking object made erratic movement in daylight in clear skys near Huntington WV.","38.3227778","-82.4469444","2009","10","25","16","0","2009","12","12"
"lavalette","WV","US","circle","10.0","Bright&#44 moving circular object dims&#44 brightens slightly then disapears in a clear sky.","38.3227778","-82.4469444","2009","4","17","21","20","2009","5","12"
"lenore","WV","US","changing","120.0","I saw  what looked like an aircraft at first.  It was flying east to west&#44 slowly.  As it came over me&#44 I realized one of the lights wa","37.7988889","-82.2869444","2011","12","24","23","0","2012","1","12"
"leon","WV","US","other","10800.0","it was a revolving light. It would change from red to green to white","38.7505556","-81.9608333","1999","2","9","13","30","1999","4","2"
"lesage","WV","US","light","5.0","Fast-moving bright white light that suddenly disappears.","38.5063889","-82.2986111","2005","9","17","21","15","2005","10","11"
"lesage","WV","US","other","300.0","amber orb shaped object moving fast than slow&#44 fast than slow silently with 2 other diff crafts almost following it","38.5063889","-82.2986111","2004","7","29","23","45","2004","8","11"
"letart","WV","US","light","2400.0","Bright light appeared and lost time now having weird dreams","38.8947222","-81.9336111","2008","3","15","23","15","2012","8","5"
"lewisburg","WV","US","triangle","1200.0","((NUFORC Note:  Witness provides no information.  PD))","37.8016667","-80.4458333","2014","1","6","19","0","2014","1","10"
"lewisburg","WV","US","triangle","900.0","I observed a triangular object hovering without sound for approximately 15 minutes during the night.","37.8016667","-80.4458333","1971","5","1","2","0","2000","6","6"
"lewisburg","WV","US","triangle","900.0","5 yellow-orange objects triangular in shape moving independant of each other in Lewiburg&#44 WV for over 15 minutes.","37.8016667","-80.4458333","2012","7","6","22","30","2012","8","5"
"logan","WV","US","cylinder","3000.0","flying silver cylinder object","37.8486111","-81.9936111","2003","9","26","18","45","2004","12","14"
"logan","WV","US","triangle","120.0","Long half a mile at least&#44 white lights along the side.","37.8486111","-81.9936111","2013","9","3","1","0","2013","10","23"
"lost creek","WV","US","light","900.0","Two lights moving slowly at tree top level around our house with no sound.","39.1611111","-80.3522222","1982","9","15","21","0","2008","1","21"
