"Location.City","Location.State","Location.Country","Data.Shape","Data.Encounter duration","Data.Description excerpt","Location.Coordinates.Latitude ","Location.Coordinates.Longitude ","Dates.Sighted.Year","Dates.Sighted.Month","Date.Sighted.Day","Dates.Sighted.Hour","Dates.Sighted.Minute","Dates.Documented.Year","Dates.Documented.Month","Dates.Documented.Day"
"lost creek","WV","US","triangle","45.0","Small triangle with 3 lights floating low over a field then slowly flying away.","39.1611111","-80.3522222","2013","10","10","21","17","2013","10","14"
"mannington","WV","US","oval","60.0","Tuesday april 3rd at 8:50 p.m. in Mannington wv I was pulling in my drive way and my two kids say &quot;hey dad what is that in the sky abov","39.5308333","-80.3436111","2012","4","3","20","50","2012","4","18"
"martinsburg","WV","US","cigar","420.0","i dont think i can explain what it truely was&#44 but im sure the govt. will deny this one too.","39.4561111","-77.9641667","2007","8","7","23","45","2007","8","7"
"martinsburg","WV","US","circle","600.0","It was the wildest thing I&#39ve ever seen and it was for sure a UFO.","39.4561111","-77.9641667","2011","10","23","22","50","2011","10","25"
"martinsburg","WV","US","circle","120.0","I saw a red ball in the sky not that high off the ground and it dissapeared","39.4561111","-77.9641667","2008","3","16","21","30","2008","3","31"
"martinsburg","WV","US","diamond","60.0","This was no ultralight or helicopter&#33 It was something totally different . it defied the laws of  nature&#33","39.4561111","-77.9641667","2009","4","23","21","35","2009","5","12"
"martinsburg","WV","US","disk","600.0","floating disc&#44 numerous quick course changes&#44  shortly afterwards aircraft seeming to &quot;grid&quot; search area.","39.4561111","-77.9641667","1973","7","20","19","0","2006","3","11"
"martinsburg","WV","US","light","600.0","Since I am not allowed to smoke in the house&#44 I have to go outside on the deck. The first night it had happened&#44 I was sitting in the c","39.4561111","-77.9641667","2012","4","1","23","30","2012","6","14"
"martinsburg","WV","US","light","10800.0","Circular light rotating ccw in the sky above the clouds from 9:00 until 12:00.  ((NUFORC Note:  Possible advertising light?  PD))","39.4561111","-77.9641667","2010","8","21","21","0","2010","8","24"
"martinsburg","WV","US","light","2.0","Very green light appeared and fell straight down.","39.4561111","-77.9641667","2013","10","2","20","5","2013","10","3"
"martinsburg","WV","US","light","7200.0","Five objects that moved too slowly to be any aircraft that made zero sound with red&#44 green&#44 blue and white lights that went in pattern","39.4561111","-77.9641667","2004","10","3","20","30","2004","10","27"
"martinsburg","WV","US","other","30.0","two-tiered configeration (like a chandelier) of bright lights perhaps one tenth the size of full moon hovering","39.4561111","-77.9641667","2004","3","13","18","30","2004","3","17"
"martinsburg","WV","US","oval","120.0","Grey elongated egg like shape.","39.4561111","-77.9641667","2013","11","16","0","0","2013","11","20"
"martinsburg","WV","US","oval","900.0","bottom of a huge aircraft hovering directly over the yard.","39.4561111","-77.9641667","1986","11","1","23","45","2006","10","30"
"martinsburg","WV","US","sphere","45.0","stationary object opened from the bottom a spotlight type beam that slowly brightened /expanded then faded away slowly then up in sky","39.4561111","-77.9641667","2009","9","18","20","0","2009","12","12"
"martinsburg","WV","US","triangle","300.0","Triagular object hovering overhead","39.4561111","-77.9641667","2008","12","14","20","30","2009","1","10"
"martinsburg","WV","US","triangle","45.0","Seen an object very high in the sky&#44 moving at a high rate of speed to the south and jumping side to side while continuing to move forw","39.4561111","-77.9641667","1989","8","10","3","0","1999","1","28"
"martinsburg","WV","US","triangle","120.0","A triangular metalic UFO exhibiting no vapor trail was spotted in the vicinity of two commercial aircraft.","39.4561111","-77.9641667","2000","9","16","7","12","2000","12","2"
"martinsburg","WV","US","unknown","6.0","huge blue light 50-80 feet wide in sky that lasted 3-6 seconds.","39.4561111","-77.9641667","2010","10","9","4","0","2010","11","21"
"martinsburg","WV","US","unknown","7200.0","Martinsburg WV&#44 10-12 lights&#44 2 witnesses&#44 we see them quite frequently. Lights go from very dim to extremely bright","39.4561111","-77.9641667","2007","6","22","23","0","2007","8","7"
"mason","WV","US","triangle","10.0","Lights fall from sky is a large black tri-angle shaped craft that is silent following large river","39.0216667","-82.0291667","2009","3","19","23","43","2009","4","14"
"masontown","WV","US","formation","60.0","bright yellow boomerang shaped formation&#44 there one minute and gone the next","39.5522222","-79.7980556","2009","7","10","0","30","2009","8","27"
"metz","WV","US","cigar","120.0","Cigar shaped no wings or tail.  no sound or contrail. Disappeared.","39.5802778","-80.37","2010","7","27","19","30","2010","7","28"
"middlebourne","WV","US","formation","420.0","3-4 very large dirt brown animal-like objects floating along side clouds","39.4922222","-80.9038889","2008","9","15","17","30","2010","6","23"
"middlebourne","WV","US","light","180.0","Two strange lights in the sky over WV.   ((NUFORC Note:  Overflight of ISS.  PD))","39.4922222","-80.9038889","2009","7","24","22","15","2009","8","5"
"milton","WV","US","cylinder","900.0","Inverted Cylinder flying the night sky near Milton WA","38.4344444","-82.1325","2002","2","11","23","50","2002","2","22"
"milton","WV","US","light","30.0","One light into two","38.4344444","-82.1325","1966","7","1","20","30","2001","8","5"
"milton","WV","US","light","960.0","24 strange lights in sky for 16 minutes.","38.4344444","-82.1325","2013","9","2","0","55","2013","9","9"
"milton","WV","US","light","600.0","A huge&#44  bright &#44 glowing light was seen in the sky above the hills of our property&#44 making no sound whatsoever....","38.4344444","-82.1325","2000","1","15","22","0","2002","3","19"
"milton","WV","US","light","60.0","bright orange lights came from south moving north in groups 1after another.","38.4344444","-82.1325","2014","4","12","20","0","2014","4","18"
"milton","WV","US","light","60.0","Two lights collided and made one. They shot off like in star trek.","38.4344444","-82.1325","2000","12","6","20","0","2001","11","20"
"milton","WV","US","light","60.0","Bright light (no meteor) crossed the sky from horizon to horizon in less than one minute.","38.4344444","-82.1325","2006","11","1","22","0","2007","3","8"
"milton","WV","US","oval","900.0","24 ORANGE LIGHTS OF MILTION&#44 WV.","38.4344444","-82.1325","2013","9","1","0","55","2013","9","9"
"montcalm","WV","US","circle","180.0","Aircraft following a possible UFO?","37.3538889","-81.2527778","2008","3","27","20","0","2008","3","31"
"morgantown","WV","US","changing","1200.0","This happened quite awhile back and I never reported it&#44 but with all the attention recently&#44 I tell people I think I saw one&#44 and they","39.6294444","-79.9561111","1978","7","4","23","0","2011","5","2"
"morgantown","WV","US","chevron","2700.0","orange orb seen rising into large chevron shaped object&#44 plus other crafts visible","39.6294444","-79.9561111","2005","9","28","1","0","2005","10","11"
"morgantown","WV","US","cigar","300.0","Cigar shape rolling through sky","39.6294444","-79.9561111","2010","8","16","19","45","2010","8","24"
"morgantown","WV","US","circle","180.0","Orange light over cheat lake","39.6294444","-79.9561111","2012","7","4","21","30","2012","8","5"
"morgantown","WV","US","circle","900.0","lookes like a star at first&#44 then it was moving...as it was moving it diment","39.6294444","-79.9561111","2005","4","2","17","0","2005","4","16"
"morgantown","WV","US","circle","10.0","Bright spherical fireball descending from the sky.","39.6294444","-79.9561111","2012","11","16","7","16","2012","11","19"
"morgantown","WV","US","circle","10.0","Solid round silver ball passing over at about 3000MSL.","39.6294444","-79.9561111","2004","10","10","14","0","2005","5","24"
"morgantown","WV","US","disk","30.0","Saucer-like object seen passing by downtown Morgantown","39.6294444","-79.9561111","2009","3","23","9","50","2009","4","14"
"morgantown","WV","US","disk","120.0","On the evening of March 25&#44 2001&#44 I was out riding my horse over the foothills of the Appalachain mountians. It was getting dark&#44 so I","39.6294444","-79.9561111","2001","3","25","21","3","2001","4","28"
"morgantown","WV","US","fireball","3.0","I saw a fireball of green light that was completely silent.","39.6294444","-79.9561111","2012","9","20","0","57","2012","9","24"
"morgantown","WV","US","fireball","20.0","Red/orange/blue bolt across the sky..","39.6294444","-79.9561111","2006","4","25","12","0","2008","10","31"
"morgantown","WV","US","light","600.0","Large spherical bright lights moving in tandem perfectly horizontally across the sky&#447 totatover 1o minutes&#44hovering stationarry and fa","39.6294444","-79.9561111","2012","7","17","22","30","2012","8","5"
"morgantown","WV","US","other","900.0","Observed 12-18 flickering&#44 yellowish-burning objects following a path NW to SE above Morgantown&#44 WV.","39.6294444","-79.9561111","2014","4","25","21","30","2014","5","2"
"morgantown","WV","US","other","120.0","strange lights above touchdown city&#44 wv  ((NUFORC Note:  Result of earlier missile launch.  PD))","39.6294444","-79.9561111","2004","8","31","20","30","2004","9","1"
"morgantown","WV","US","other","3600.0","Orange lines and dots on the horizon of the sunset; differed in size and shape; moving very slowly&#44 while disappearing and reappearing.","39.6294444","-79.9561111","2012","9","19","19","0","2012","9","24"
"morgantown","WV","US","sphere","300.0","redish-orange glowing sphere","39.6294444","-79.9561111","2007","3","29","9","30","2007","4","27"
"morgantown","WV","US","sphere","4.0","Orange sphere descends over Morgantown airport.","39.6294444","-79.9561111","2012","12","14","23","17","2012","12","20"
"morgantown","WV","US","triangle","90.0","triangle shape with a light on each tip of the triangle. a red light on the top tip of the triangle.","39.6294444","-79.9561111","2009","11","8","23","35","2009","12","12"
"morgantown","WV","US","triangle","5.0","Triangle shaped BLUE UFO Morgantown West Va","39.6294444","-79.9561111","2012","11","15","21","0","2013","9","30"
"morgantown","WV","US","triangle","1200.0","I saw a triangle shape in the sky that seemed to hover in one place then it started spinning it was black the lights were yellowish. Th","39.6294444","-79.9561111","1999","3","4","21","35","1999","4","2"
"morgantown","WV","US","triangle","20.0","Y-shaped or triangular object in the sky overhead&#44 traveling westward.","39.6294444","-79.9561111","2011","8","29","22","50","2011","10","10"
"morgantown","WV","US","triangle","900.0","I was working as a DJ at WCLG in Morgantown WV.  I am sorry I dont know the date and am sorry that I am now reporting a 9 year old sigh","39.6294444","-79.9561111","1989","10","15","10","30","1999","1","28"
"morgantown","WV","US","unknown","5.0","beam enters my room","39.6294444","-79.9561111","2004","11","1","21","0","2004","11","9"
"morgantown","WV","US","unknown","3600.0","I commented on a strange light in the sky that didn&#39t move.  ((NUFORC Note:  Probably Sirius.  PD))","39.6294444","-79.9561111","2005","4","13","22","0","2005","4","16"
"moundsville","WV","US","circle","300.0","22:15pm Moundsville&#44WV Circle of light 5minutes duration Brite light over Moundsville 7 / 11 / 2009","39.9202778","-80.7433333","2009","7","11","22","0","2009","8","5"
"moundsville","WV","US","disk","120.0","UFO sighting Moundsville WV","39.9202778","-80.7433333","2007","10","28","20","0","2007","11","28"
"moundsville","WV","US","light","20.0","Bright&#44 slow-moving&#44 star-like light","39.9202778","-80.7433333","1998","2","8","19","20","1999","1","28"
"moundsville","WV","US","light","120.0","I was scanning the night sky with 7x50 binoculars when I noticed a light much higher than commercial aircraft usually fly.","39.9202778","-80.7433333","1998","6","21","22","10","1998","11","21"
"moundsville","WV","US","other","300.0","Bright then fade","39.9202778","-80.7433333","2005","9","21","22","39","2005","10","11"
"moundsville","WV","US","oval","180.0","an oval twinkling light that turned orange and shot across the sky three times in a blue strek forming a triangular flight pattern&#44stop","39.9202778","-80.7433333","2013","7","3","22","5","2013","7","5"
"moundsville","WV","US","triangle","600.0","Three lights in the sky tat formed a perfect triangle","39.9202778","-80.7433333","2012","8","7","22","25","2012","8","19"
"mount hope","WV","US","unknown","1800.0","Object only visible as a streak of light at very high altitude traveled from horizon to horizon in a few seconds for a total of 6 times","37.8952778","-81.1644444","1961","7","15","23","0","2003","7","16"
"mt. lookout","WV","US","cigar","20.0","cigar shaped object disappeared in the sky","38.1666667","-80.9119444","2006","1","7","17","30","2006","2","14"
"mt. lookout","WV","US","cylinder","20.0","Silver cylinder obect flying close to public beach.","38.1666667","-80.9119444","2012","6","13","18","0","2012","7","4"
"mt. olive","WV","US","unknown","60.0","Flying object over Mt.Olive West Virginia","38.2377778","-81.2336111","2001","10","15","23","59","2007","11","28"
"new cumberland","WV","US","light","60.0","High Altitude Bright Light during mid-day","40.4966667","-80.6069444","2009","5","18","14","23","2009","6","9"
"new cumberland","WV","US","triangle","600.0","Three red lights forming a triangle in the sky","40.4966667","-80.6069444","2012","9","3","21","45","2012","9","24"
"new haven","WV","US","disk","6.0","Disk shaped object sited over Mason County W.V. traveling at high rate of speed.","38.9863889","-81.9736111","2000","10","12","17","40","2000","12","2"
"new haven","WV","US","sphere","30.0","The object  slowly climbed up just above the horizon&#44 disappeared&#44 reappeared some distance away&#44 and disappeared again.","38.9863889","-81.9736111","1999","6","15","22","0","2004","6","18"
"new martinsville","WV","US","disk","45.0","Orange Compact Disc Shaped UFO Seen Over West Virginia","39.6444444","-80.8577778","2003","3","8","20","0","2003","3","21"
"new martinsville","WV","US","light","600.0","Object that changes colors follows our car.","39.6444444","-80.8577778","1971","5","5","20","0","2012","4","18"
"normantown","WV","US","unknown","240.0","Stationary&#44 star-like white lights suddenly approached and passed directly overhead","38.8516667","-80.9366667","2009","11","26","18","30","2013","8","30"
"oak hill","WV","US","chevron","20.0","a large boomerang shaped craft with glowing pulsating front edge soared silently at about cloud level for about 25 secs on clear night","37.9722222","-81.1488889","2012","5","15","21","0","2012","12","20"
"oak hill","WV","US","fireball","2631600.0","Burning glowing sphere(sparks)","37.9722222","-81.1488889","1996","7","5","0","0","2004","6","4"
"oak hill","WV","US","formation","180.0","3 solid red lights in v formation(appeared at least 100ft wide)coming from the south. Slow moving  no noise","37.9722222","-81.1488889","2007","1","3","18","45","2007","2","1"
"oak hill","WV","US","unknown","360.0","They appeared to be flares and i would say they were about the size of a soda machine  each","37.9722222","-81.1488889","2012","2","20","22","0","2012","3","13"
"oakvale","WV","US","cylinder","2.0","Being followed by something unknown.......","37.3341667","-80.9627778","1988","9","12","23","30","2001","3","6"
"odd","WV","US","triangle","120.0","black triangular shaped aircraft photographed during the day.  ((NUFORC Note:  Object probably is a bat&#44 or a butterfly.  PD))","37.5933333","-81.1941667","2008","7","30","9","6","2008","10","31"
"ona","WV","US","triangle","300.0","Three-lighted triangular object&#44 slow moving outside Huntington&#44 West Virginia.","38.4247222","-82.2133333","2004","5","8","2","0","2004","6","4"
"panther","WV","US","light","300.0","It was about dark I was cleaning out my truck &#44I was listening to music  with the windows rolled up&#44 I can&#39t remember the exact date&#44 b","37.4833333","-81.8961111","2013","3","15","19","45","2014","1","24"
"parkersburg","WV","US","cigar","300.0","Cigar shaped silver shining object seen in clear daytime sky.","39.2666667","-81.5616667","2005","2","15","14","45","2005","5","11"
"parkersburg","WV","US","cigar","60.0","I observed May 14 2013 at 20:15hrs&#44 1 white cigar shaped obj. 20ft or more in length flying at low altitude (no jet stream).","39.2666667","-81.5616667","2013","5","14","20","15","2013","5","15"
"parkersburg","WV","US","circle","30.0","Large bright white light traveling quicky in the Northwest sky.","39.2666667","-81.5616667","2013","6","28","1","30","2013","7","3"
"parkersburg","WV","US","circle","180.0","Multi-colored craft hovering above me.","39.2666667","-81.5616667","1980","6","1","5","0","2012","10","30"
"parkersburg","WV","US","circle","10.0","the object gave off a light that illuminated the entire sky then disapated completely.","39.2666667","-81.5616667","2004","10","13","23","0","2005","5","24"
"parkersburg","WV","US","circle","60.0","Bright white light flying in the sky&#44 hovering and diapeared before our eyes.  ((NUFORC Note:  Satellite??  PD))","39.2666667","-81.5616667","2008","6","5","22","10","2008","6","12"
"parkersburg","WV","US","cylinder","120.0","Cylinder/cigar shaped &quot;light tube&quot; slowly climbs higher and higher","39.2666667","-81.5616667","1999","8","15","1","0","2003","8","28"
"parkersburg","WV","US","light","300.0","Several lights seen over Parkersburg&#44 WV","39.2666667","-81.5616667","2014","5","3","21","45","2014","5","8"
"parkersburg","WV","US","light","30.0","Hovering red light over Parkersburg.","39.2666667","-81.5616667","2013","6","21","22","50","2013","7","3"
"parkersburg","WV","US","light","30.0","Bright orange light moves rapidly across the sky and dissappears suddenly&#44 three witnesses.","39.2666667","-81.5616667","2012","8","25","22","30","2012","9","24"
"parkersburg","WV","US","light","30.0","On 5 Sep 2001&#44 at approx. 2049&#44A bright white light&#44 that swelled and disappeared&#44 was seen from Parkersburg&#44 WV in the north sky.","39.2666667","-81.5616667","2001","9","5","20","49","2001","10","12"
"parkersburg","WV","US","other","120.0","Four huge lights flying at me 150 feet off the ground...","39.2666667","-81.5616667","2001","5","26","17","0","2006","5","15"
"parkersburg","WV","US","oval","20.0","Saw a ufo on the way to school near a cow field.  ((NUFORC Note:  Student report.  PD))","39.2666667","-81.5616667","2005","5","15","7","45","2005","7","15"
"parkersburg","WV","US","unknown","240.0","Object made 3 - 90 degree turns and then disappeared.","39.2666667","-81.5616667","2009","8","27","21","0","2009","8","28"
"paw paw","WV","US","oval","2.0","I heard some yelling outside&#44 so i looked out my window and saw a bright white flash that zoomed off into the sky and dissapeared.","39.5319444","-78.4586111","2012","8","1","2","0","2012","8","5"
"pennsboro","WV","US","light","20.0","Blueish light seen wabbleing through the sky over pennsboro wv","39.285","-80.9686111","2012","8","6","22","0","2012","8","19"
"philippi","WV","US","teardrop","170.0","Bright blue/white orb forms hazy cloud&#44 changes shape to teardrop.  ((NUFORC Note:  Possible sighting of Venus.  PD))","39.1522222","-80.0405556","2012","4","3","21","45","2012","4","18"
"poca","WV","US","disk","120.0","Standing outside on front porch when strange disk shaped object flew over a hill and headed as if it was to land. One witness told anot","38.4722222","-81.8144444","1999","9","28","22","0","2002","7","1"
"point pleasant","WV","US","flash","18000.0","3 pulsating lights in small town West Virginia","38.8444444","-82.1372222","2012","9","22","23","30","2012","10","30"
"point pleasant","WV","US","triangle","3600.0","I saw a large triangular craft with 3 non flashing/blinking lights just above my car.","38.8444444","-82.1372222","1999","6","15","23","30","2003","9","4"
"point pleasant","WV","US","unknown","600.0","Strange object circles my backyard&#33","38.8444444","-82.1372222","1989","6","15","2","0","2013","4","12"
"point pleasant","WV","US","unknown","600.0","Odd lights in the sky around Point Pleasant WV.","38.8444444","-82.1372222","2013","7","25","2","43","2013","8","30"
"princeton","WV","US","circle","180.0","Light yellowish white circle of light looking like a full moon started moving&#44 descending down behind trees of horizon.","37.3661111","-81.1027778","2013","12","13","3","30","2013","12","23"
"princeton","WV","US","circle","2.0","blue orb and dream","37.3661111","-81.1027778","2007","4","4","10","0","2010","6","10"
"princeton","WV","US","cylinder","3600.0","UFO? over Princeton/Oakvale&#44 WV.","37.3661111","-81.1027778","2014","1","7","20","0","2014","1","10"
"princeton","WV","US","formation","1200.0","Sitting in wal-mart parking lot......noticed what appeared to be bright stars....after the sun went all the way down&#44 the lights remain","37.3661111","-81.1027778","2013","5","14","20","45","2013","6","2"
"princeton","WV","US","light","2400.0","Brite white star light object positioned from the E followed me to  my work site on Fri. a.m..","37.3661111","-81.1027778","2014","2","28","5","20","2014","3","18"
"princeton","WV","US","light","60.0","Cobalt bue lightning like flashes near I-77 exit 9 at Princeton&#44 WV.","37.3661111","-81.1027778","2014","2","2","22","0","2014","2","7"
"princeton","WV","US","other","60.0","Flat precise platinum line viewed low in sky&#44 descending at sharp angle&#44 tilted to show shape&#44 modified triangular&#44 immediately masked.","37.3661111","-81.1027778","2013","11","14","15","0","2013","12","23"
"princeton","WV","US","oval","2.0","neon blue orb streaking by Size of the moon almost at about 4 500 feet up in the air for 2 seconds the completely disappeared","37.3661111","-81.1027778","2011","7","28","12","20","2011","8","7"
"rachel","WV","US","light","40.0","Moving light gets swallowed up by the moon.","39.5183333","-80.3038889","2008","2","14","19","30","2008","3","4"
"rainelle","WV","US","unknown","1800.0","Witnessed floating&#44 slow moving object with wierd circular light outside of Rainelle&#44 WV.","37.9686111","-80.7672222","2014","4","20","22","0","2014","4","24"
"ranger","WV","US","triangle","900.0","Late night summer of 1979.  Three triangle shaped craft.","38.1205556","-82.1855556","1979","7","15","21","30","1998","11","1"
"ravenswood","WV","US","light","300.0","Bright red hovering circular light near Ravenswood.","38.9480556","-81.7611111","2013","7","4","21","30","2013","7","5"
"ravenswood","WV","US","light","60.0","Two bright lights in eastern hemisphere at a 45 degree angle","38.9480556","-81.7611111","2007","3","30","21","1","2007","4","27"
"ravenswood","WV","US","sphere","120.0","I was heading to bed and went out to smoke a cigarette and looked up in the sky and noticed an orange ball in the sky that turned red.","38.9480556","-81.7611111","2013","8","17","23","30","2013","8","30"
"reedsville","WV","US","sphere","300.0","2 smaller spheres dropped out of 1 largers sphere. Larger sphere was pewter &amp; 2 smaller sphere&#39s were pewter&#33  Samller sphere&#39s manuve","39.5105556","-79.7986111","1983","8","1","14","30","2012","3","13"
"reedsville","WV","US","triangle","60.0","Dark-colored&#44 silent&#44 hovering triangle with red and white lights.","39.5105556","-79.7986111","2013","10","15","23","30","2013","12","2"
"reedsville","WV","US","triangle","60.0","I saw the triangle lights more than once","39.5105556","-79.7986111","1997","7","15","1","0","2005","2","22"
"reedsville","WV","US","unknown","300.0","We got beam with a brilliant light from the sky.","39.5105556","-79.7986111","1999","7","15","3","0","2005","2","22"
"reedy","WV","US","changing","2700.0","It started like a bright star&#44then moved quickly across the sky&#44 changing colors.  ((NUFORC Note:  Star or planet??  PD))","38.8994444","-81.425","2007","5","15","23","0","2007","6","12"
"richwood","WV","US","formation","2.0","Monongahelia National Forest/Marlingto Road UFO Formation sighting.","38.2247222","-80.5333333","1996","8","15","19","0","2013","12","2"
"rio","WV","US","flash","10.0","Strange flash of light once every four minutes in distant space west of orions belt","39.1383333","-78.6702778","2012","2","26","20","45","2012","3","13"
"ripley","WV","US","circle","60.0","A round shiney object that was slower than a helicopter and like a ballon.","38.8186111","-81.7108333","2005","2","25","17","0","2005","4","16"
"rippon","WV","US","other","10.0","Round gold object with white &quot;wings&quot; near Rippon&#44 West Virginia.","39.2183333","-77.9055556","2002","5","1","17","30","2002","5","14"
"rivesville","WV","US","cross","180.0","Spherical object that turned into a cross pattern .","39.5297222","-80.1169444","2013","6","8","21","0","2013","7","3"
"rockport","WV","US","fireball","30.0","Fireball falling from sky but slow landed on ground and glowed for about 30 seconds then went out.","39.0741667","-81.5533333","2005","10","20","4","15","2005","11","3"
"rockport","WV","US","light","600.0","Horizontal bar of single blue and red lights in the southern sky with lights appearing to be about the size of large stars","39.0741667","-81.5533333","2006","3","11","5","30","2006","5","15"
"rockport","WV","US","light","600.0","Vertical line of three blue and red lights about three or four times the size of stars or planets well above the southern horizon.","39.0741667","-81.5533333","2006","3","11","5","30","2006","5","15"
